id,name,logo_path,parent_id,territory_id,official_name,code,gender,is_active,team_type
1153,Guernsey U20 National Team,user://assets/textures/territory_logo/97.webp,97,97,Guernsey U20 National Team,,0,1,1
1154,Guinea U20 National Team,user://assets/textures/territory_logo/98.webp,98,98,Republic of Guinea U20 National Team,,0,1,1
1155,Guinea-Bissau U20 National Team,user://assets/textures/territory_logo/99.webp,99,99,Republic of Guinea-Bissau U20 National Team,,0,1,1
1156,Guyana U20 National Team,user://assets/textures/territory_logo/100.webp,100,100,Co-operative Republic of Guyana U20 National Team,,0,1,1
1157,Haiti U20 National Team,user://assets/textures/territory_logo/101.webp,101,101,Republic of Haiti U20 National Team,,0,1,1
1158,Hawaii U20 National Team,user://assets/textures/territory_logo/102.webp,102,102,Hawaii U20 National Team,,0,1,1
1159,Honduras U20 National Team,user://assets/textures/territory_logo/103.webp,103,103,Republic of Honduras U20 National Team,,0,1,1
1160,Hong Kong U20 National Team,user://assets/textures/territory_logo/104.webp,104,104,Hong Kong U20 National Team,,0,1,1
1161,Hungary U20 National Team,user://assets/textures/territory_logo/105.webp,105,105,Hungary U20 National Team,,0,1,1
1162,Iceland U20 National Team,user://assets/textures/territory_logo/106.webp,106,106,Iceland U20 National Team,,0,1,1
1163,India U20 National Team,user://assets/textures/territory_logo/107.webp,107,107,Republic of India U20 National Team,,0,1,1
1164,Indonesia U20 National Team,user://assets/textures/territory_logo/108.webp,108,108,Republic of Indonesia U20 National Team,,0,1,1
1165,Iran U20 National Team,user://assets/textures/territory_logo/109.webp,109,109,Islamic Republic of Iran U20 National Team,,0,1,1
1166,Iraq U20 National Team,user://assets/textures/territory_logo/110.webp,110,110,Republic of Iraq U20 National Team,,0,1,1
1167,Ireland U20 National Team,user://assets/textures/territory_logo/111.webp,111,111,Republic of Ireland U20 National Team,,0,1,1
1168,Isle of Man U20 National Team,user://assets/textures/territory_logo/112.webp,112,112,Isle of Man U20 National Team,,0,1,1
1169,Isle of Wight U20 National Team,user://assets/textures/territory_logo/113.webp,113,113,Isle of Wight U20 National Team,,0,1,1
1170,Isles of Scilly U20 National Team,user://assets/textures/territory_logo/114.webp,114,114,Isles of Scilly U20 National Team,,0,1,1
1171,Israel U20 National Team,user://assets/textures/territory_logo/115.webp,115,115,State of Israel U20 National Team,,0,1,1
1172,Italy U20 National Team,user://assets/textures/territory_logo/116.webp,116,116,Italian Republic U20 National Team,,0,1,1
1173,Ivory Coast U20 National Team,user://assets/textures/territory_logo/117.webp,117,117,Republic of Côte d'Ivoire U20 National Team,,0,1,1
1174,Jamaica U20 National Team,user://assets/textures/territory_logo/118.webp,118,118,Jamaica U20 National Team,,0,1,1
1175,Japan U20 National Team,user://assets/textures/territory_logo/119.webp,119,119,Japan U20 National Team,,0,1,1
1176,Jersey U20 National Team,user://assets/textures/territory_logo/120.webp,120,120,Bailiwick of Jersey U20 National Team,,0,1,1
1177,Jordan U20 National Team,user://assets/textures/territory_logo/121.webp,121,121,Hashemite Kingdom of Jordan U20 National Team,,0,1,1
1178,Kazakhstan U20 National Team,user://assets/textures/territory_logo/122.webp,122,122,Republic of Kazakhstan U20 National Team,,0,1,1
1179,Kenya U20 National Team,user://assets/textures/territory_logo/123.webp,123,123,Republic of Kenya U20 National Team,,0,1,1
1180,Kiribati U20 National Team,user://assets/textures/territory_logo/124.webp,124,124,Republic of Kiribati U20 National Team,,0,1,1
1181,Kosovo U20 National Team,user://assets/textures/territory_logo/125.webp,125,125,Republic of Kosovo U20 National Team,,0,1,1
1182,Kuwait U20 National Team,user://assets/textures/territory_logo/126.webp,126,126,State of Kuwait U20 National Team,,0,1,1
1183,Kyrgyzstan U20 National Team,user://assets/textures/territory_logo/127.webp,127,127,Kyrgyz Republic U20 National Team,,0,1,1
1184,Laos U20 National Team,user://assets/textures/territory_logo/128.webp,128,128,Lao People's Democratic Republic U20 National Team,,0,1,1
1185,Latvia U20 National Team,user://assets/textures/territory_logo/129.webp,129,129,Republic of Latvia U20 National Team,,0,1,1
1186,Lebanon U20 National Team,user://assets/textures/territory_logo/130.webp,130,130,Republic of Lebanon U20 National Team,,0,1,1
1187,Lesotho U20 National Team,user://assets/textures/territory_logo/131.webp,131,131,Kingdom of Lesotho U20 National Team,,0,1,1
1188,Liberia U20 National Team,user://assets/textures/territory_logo/132.webp,132,132,Republic of Liberia U20 National Team,,0,1,1
1189,Libya U20 National Team,user://assets/textures/territory_logo/133.webp,133,133,State of Libya U20 National Team,,0,1,1
1190,Liechtenstein U20 National Team,user://assets/textures/territory_logo/134.webp,134,134,Principality of Liechtenstein U20 National Team,,0,1,1
1191,Lithuania U20 National Team,user://assets/textures/territory_logo/135.webp,135,135,Republic of Lithuania U20 National Team,,0,1,1
1192,Luxembourg U20 National Team,user://assets/textures/territory_logo/136.webp,136,136,Grand Duchy of Luxembourg U20 National Team,,0,1,1
1193,Macau U20 National Team,user://assets/textures/territory_logo/137.webp,137,137,Macau U20 National Team,,0,1,1
1194,Madagascar U20 National Team,user://assets/textures/territory_logo/138.webp,138,138,Republic of Madagascar U20 National Team,,0,1,1
1195,Madeira U20 National Team,user://assets/textures/territory_logo/139.webp,139,139,Autonomous Region of Madeira U20 National Team,,0,1,1
1196,Malawi U20 National Team,user://assets/textures/territory_logo/140.webp,140,140,Republic of Malawi U20 National Team,,0,1,1
1197,Malaysia U20 National Team,user://assets/textures/territory_logo/141.webp,141,141,Malaysia U20 National Team,,0,1,1
1198,Maldives U20 National Team,user://assets/textures/territory_logo/142.webp,142,142,Republic of Maldives U20 National Team,,0,1,1
1199,Mali U20 National Team,user://assets/textures/territory_logo/143.webp,143,143,Republic of Mali U20 National Team,,0,1,1
1200,Malta U20 National Team,user://assets/textures/territory_logo/144.webp,144,144,Republic of Malta U20 National Team,,0,1,1
1201,Marshall Islands U20 National Team,user://assets/textures/territory_logo/145.webp,145,145,Republic of the Marshall Islands U20 National Team,,0,1,1
1202,Martinique U20 National Team,user://assets/textures/territory_logo/146.webp,146,146,Martinique U20 National Team,,0,1,1
1203,Mauritania U20 National Team,user://assets/textures/territory_logo/147.webp,147,147,Islamic Republic of Mauritania U20 National Team,,0,1,1
1204,Mauritius U20 National Team,user://assets/textures/territory_logo/148.webp,148,148,Republic of Mauritius U20 National Team,,0,1,1
1205,Mayotte U20 National Team,user://assets/textures/territory_logo/149.webp,149,149,Department of Mayotte U20 National Team,,0,1,1
1206,Mexico U20 National Team,user://assets/textures/territory_logo/150.webp,150,150,United Mexican States U20 National Team,,0,1,1
1207,Moldova U20 National Team,user://assets/textures/territory_logo/151.webp,151,151,Republic of Moldova U20 National Team,,0,1,1
1208,Monaco U20 National Team,user://assets/textures/territory_logo/152.webp,152,152,Principality of Monaco U20 National Team,,0,1,1
1209,Mongolia U20 National Team,user://assets/textures/territory_logo/153.webp,153,153,Mongolia U20 National Team,,0,1,1
1210,Montenegro U20 National Team,user://assets/textures/territory_logo/154.webp,154,154,Montenegro U20 National Team,,0,1,1
1211,Montserrat U20 National Team,user://assets/textures/territory_logo/155.webp,155,155,Montserrat U20 National Team,,0,1,1
1212,Morocco U20 National Team,user://assets/textures/territory_logo/156.webp,156,156,Kingdom of Morocco U20 National Team,,0,1,1
1213,Mozambique U20 National Team,user://assets/textures/territory_logo/157.webp,157,157,Republic of Mozambique U20 National Team,,0,1,1
1214,Myanmar U20 National Team,user://assets/textures/territory_logo/158.webp,158,158,Republic of the Union of Myanmar U20 National Team,,0,1,1
1215,Namibia U20 National Team,user://assets/textures/territory_logo/159.webp,159,159,Republic of Namibia U20 National Team,,0,1,1
1216,Nauru U20 National Team,user://assets/textures/territory_logo/160.webp,160,160,Republic of Nauru U20 National Team,,0,1,1
1217,Nepal U20 National Team,user://assets/textures/territory_logo/161.webp,161,161,Federal Democratic Republic of Nepal U20 National Team,,0,1,1
1218,Netherlands U20 National Team,user://assets/textures/territory_logo/162.webp,162,162,Kingdom of the Netherlands U20 National Team,,0,1,1
1219,New Caledonia U20 National Team,user://assets/textures/territory_logo/163.webp,163,163,New Caledonia U20 National Team,,0,1,1
1220,New Zealand U20 National Team,user://assets/textures/territory_logo/164.webp,164,164,New Zealand U20 National Team,,0,1,1
1221,Nicaragua U20 National Team,user://assets/textures/territory_logo/165.webp,165,165,Republic of Nicaragua U20 National Team,,0,1,1
1222,Niger U20 National Team,user://assets/textures/territory_logo/166.webp,166,166,Republic of the Niger U20 National Team,,0,1,1
1223,Nigeria U20 National Team,user://assets/textures/territory_logo/167.webp,167,167,Federal Republic of Nigeria U20 National Team,,0,1,1
1224,Niue U20 National Team,user://assets/textures/territory_logo/168.webp,168,168,Niue U20 National Team,,0,1,1
1225,Norfolk Island U20 National Team,user://assets/textures/territory_logo/169.webp,169,169,Norfolk Island U20 National Team,,0,1,1
1226,North Korea U20 National Team,user://assets/textures/territory_logo/170.webp,170,170,Democratic People's Republic of Korea U20 National Team,,0,1,1
1227,North Macedonia U20 National Team,user://assets/textures/territory_logo/171.webp,171,171,Republic of North Macedonia U20 National Team,,0,1,1
1228,Northern Cyprus U20 National Team,user://assets/textures/territory_logo/172.webp,172,172,Turkish Republic of Northern Cyprus U20 National Team,,0,1,1
1229,Northern Ireland U20 National Team,user://assets/textures/territory_logo/173.webp,173,173,Northern Ireland U20 National Team,,0,1,1
1230,Northern Mariana Islands U20 National Team,user://assets/textures/territory_logo/174.webp,174,174,Commonwealth of the Northern Mariana Islands U20 National Team,,0,1,1
1231,Norway U20 National Team,user://assets/textures/territory_logo/175.webp,175,175,Kingdom of Norway U20 National Team,,0,1,1
1232,Oman U20 National Team,user://assets/textures/territory_logo/176.webp,176,176,Sultanate of Oman U20 National Team,,0,1,1
1233,Orkney U20 National Team,user://assets/textures/territory_logo/177.webp,177,177,Orkney U20 National Team,,0,1,1
1234,Pakistan U20 National Team,user://assets/textures/territory_logo/178.webp,178,178,Islamic Republic of Pakistan U20 National Team,,0,1,1
1235,Palau U20 National Team,user://assets/textures/territory_logo/179.webp,179,179,Republic of Palau U20 National Team,,0,1,1
1236,Palestine U20 National Team,user://assets/textures/territory_logo/180.webp,180,180,State of Palestine U20 National Team,,0,1,1
1237,Panama U20 National Team,user://assets/textures/territory_logo/181.webp,181,181,Republic of Panama U20 National Team,,0,1,1
1238,Papua New Guinea U20 National Team,user://assets/textures/territory_logo/182.webp,182,182,Independent State of Papua New Guinea U20 National Team,,0,1,1
1239,Paraguay U20 National Team,user://assets/textures/territory_logo/183.webp,183,183,Republic of Paraguay U20 National Team,,0,1,1
1240,Peru U20 National Team,user://assets/textures/territory_logo/184.webp,184,184,Republic of Peru U20 National Team,,0,1,1
1241,Philippines U20 National Team,user://assets/textures/territory_logo/185.webp,185,185,Republic of the Philippines U20 National Team,,0,1,1
1242,Pitcairn Islands U20 National Team,user://assets/textures/territory_logo/186.webp,186,186,"Pitcairn, Henderson, Ducie and Oeno Islands U20 National Team",,0,1,1
1243,Poland U20 National Team,user://assets/textures/territory_logo/187.webp,187,187,Republic of Poland U20 National Team,,0,1,1
1244,Portugal U20 National Team,user://assets/textures/territory_logo/188.webp,188,188,Portuguese Republic U20 National Team,,0,1,1
1245,Puerto Rico U20 National Team,user://assets/textures/territory_logo/189.webp,189,189,Commonwealth of Puerto Rico U20 National Team,,0,1,1
1246,Qatar U20 National Team,user://assets/textures/territory_logo/190.webp,190,190,State of Qatar U20 National Team,,0,1,1
1247,Réunion U20 National Team,user://assets/textures/territory_logo/191.webp,191,191,Réunion U20 National Team,,0,1,1
1248,Romania U20 National Team,user://assets/textures/territory_logo/192.webp,192,192,Romania U20 National Team,,0,1,1
1249,Russia U20 National Team,user://assets/textures/territory_logo/193.webp,193,193,Russian Federation U20 National Team,,0,1,1
1250,Rwanda U20 National Team,user://assets/textures/territory_logo/194.webp,194,194,Republic of Rwanda U20 National Team,,0,1,1
1251,Saba U20 National Team,user://assets/textures/territory_logo/195.webp,195,195,Saba U20 National Team,,0,1,1
1252,Sahrawi Republic U20 National Team,user://assets/textures/territory_logo/196.webp,196,196,Sahrawi Arab Democratic Republic U20 National Team,,0,1,1
1253,Saint Helena U20 National Team,user://assets/textures/territory_logo/197.webp,197,197,Saint Helena U20 National Team,,0,1,1
1254,Saint Kitts and Nevis U20 National Team,user://assets/textures/territory_logo/198.webp,198,198,Federation of Saint Kitts and Nevis U20 National Team,,0,1,1
1255,Saint Lucia U20 National Team,user://assets/textures/territory_logo/199.webp,199,199,Saint Lucia U20 National Team,,0,1,1
1256,Saint Martin U20 National Team,user://assets/textures/territory_logo/200.webp,200,200,Saint Martin U20 National Team,,0,1,1
1257,Saint Pierre and Miquelon U20 National Team,user://assets/textures/territory_logo/201.webp,201,201,Territorial Collectivity of Saint Pierre and Miquelon U20 National Team,,0,1,1
1258,Saint Vincent and the Grenadines U20 National Team,user://assets/textures/territory_logo/202.webp,202,202,Saint Vincent and the Grenadines U20 National Team,,0,1,1
1259,Saint-Barthélemy U20 National Team,user://assets/textures/territory_logo/203.webp,203,203,Collectivité territoriale de Saint-Barthélemy U20 National Team,,0,1,1
1260,Samoa U20 National Team,user://assets/textures/territory_logo/204.webp,204,204,Independent State of Samoa U20 National Team,,0,1,1
1261,San Marino U20 National Team,user://assets/textures/territory_logo/205.webp,205,205,Republic of San Marino U20 National Team,,0,1,1
1262,São Tomé and Príncipe U20 National Team,user://assets/textures/territory_logo/206.webp,206,206,Democratic Republic of São Tomé and Príncipe U20 National Team,,0,1,1
1263,Saudi Arabia U20 National Team,user://assets/textures/territory_logo/207.webp,207,207,Kingdom of Saudi Arabia U20 National Team,,0,1,1
1264,Scotland U20 National Team,user://assets/textures/territory_logo/208.webp,208,208,Scotland U20 National Team,,0,1,1
1265,Senegal U20 National Team,user://assets/textures/territory_logo/209.webp,209,209,Republic of Senegal U20 National Team,,0,1,1
1266,Serbia U20 National Team,user://assets/textures/territory_logo/210.webp,210,210,Republic of Serbia U20 National Team,,0,1,1
1267,Seychelles U20 National Team,user://assets/textures/territory_logo/211.webp,211,211,Republic of Seychelles U20 National Team,,0,1,1
1268,Sierra Leone U20 National Team,user://assets/textures/territory_logo/212.webp,212,212,Republic of Sierra Leone U20 National Team,,0,1,1
1269,Singapore U20 National Team,user://assets/textures/territory_logo/213.webp,213,213,Republic of Singapore U20 National Team,,0,1,1
1270,Sint Eustatius U20 National Team,user://assets/textures/territory_logo/214.webp,214,214,Sint Eustatius U20 National Team,,0,1,1
1271,Sint Maarten U20 National Team,user://assets/textures/territory_logo/215.webp,215,215,Sint Maarten U20 National Team,,0,1,1
1272,Slovakia U20 National Team,user://assets/textures/territory_logo/216.webp,216,216,Slovak Republic U20 National Team,,0,1,1
1273,Slovenia U20 National Team,user://assets/textures/territory_logo/217.webp,217,217,Republic of Slovenia U20 National Team,,0,1,1
1274,Solomon Islands U20 National Team,user://assets/textures/territory_logo/218.webp,218,218,Solomon Islands U20 National Team,,0,1,1
1275,Somalia U20 National Team,user://assets/textures/territory_logo/219.webp,219,219,Federal Republic of Somalia U20 National Team,,0,1,1
1276,Somaliland U20 National Team,user://assets/textures/territory_logo/220.webp,220,220,Republic of Somaliland U20 National Team,,0,1,1
1277,South Africa U20 National Team,user://assets/textures/territory_logo/221.webp,221,221,Republic of South Africa U20 National Team,,0,1,1
1278,South Korea U20 National Team,user://assets/textures/territory_logo/222.webp,222,222,Republic of Korea U20 National Team,,0,1,1
1279,South Ossetia U20 National Team,user://assets/textures/territory_logo/223.webp,223,223,Republic of South Ossetia U20 National Team,,0,1,1
1280,South Sudan U20 National Team,user://assets/textures/territory_logo/224.webp,224,224,Republic of South Sudan U20 National Team,,0,1,1
1281,Sovereign Military Order of Malta U20 National Team,user://assets/textures/territory_logo/225.webp,225,225,"Sovereign Military Hospitaller Order of Saint John of Jerusalem, of Rhodes and of Malta U20 National Team",,0,1,1
1282,Spain U20 National Team,user://assets/textures/territory_logo/226.webp,226,226,Kingdom of Spain U20 National Team,,0,1,1
1283,Sri Lanka U20 National Team,user://assets/textures/territory_logo/227.webp,227,227,Democratic Socialist Republic of Sri Lanka U20 National Team,,0,1,1
1284,Sudan U20 National Team,user://assets/textures/territory_logo/228.webp,228,228,Republic of the Sudan U20 National Team,,0,1,1
1285,Suriname U20 National Team,user://assets/textures/territory_logo/229.webp,229,229,Republic of Suriname U20 National Team,,0,1,1
1286,Sweden U20 National Team,user://assets/textures/territory_logo/230.webp,230,230,Kingdom of Sweden U20 National Team,,0,1,1
1287,Switzerland U20 National Team,user://assets/textures/territory_logo/231.webp,231,231,Swiss Confederation U20 National Team,,0,1,1
1288,Syria U20 National Team,user://assets/textures/territory_logo/232.webp,232,232,Syrian Arab Republic U20 National Team,,0,1,1
1289,Taiwan U20 National Team,user://assets/textures/territory_logo/233.webp,233,233,Republic of China U20 National Team,,0,1,1
1290,Tajikistan U20 National Team,user://assets/textures/territory_logo/234.webp,234,234,Republic of Tajikistan U20 National Team,,0,1,1
1291,Tanzania U20 National Team,user://assets/textures/territory_logo/235.webp,235,235,United Republic of Tanzania U20 National Team,,0,1,1
1292,Thailand U20 National Team,user://assets/textures/territory_logo/236.webp,236,236,Kingdom of Thailand U20 National Team,,0,1,1
1293,Togo U20 National Team,user://assets/textures/territory_logo/237.webp,237,237,Togolese Republic U20 National Team,,0,1,1
1294,Tokelau U20 National Team,user://assets/textures/territory_logo/238.webp,238,238,Tokelau U20 National Team,,0,1,1
1295,Tonga U20 National Team,user://assets/textures/territory_logo/239.webp,239,239,Kingdom of Tonga U20 National Team,,0,1,1
1296,Transnistria U20 National Team,user://assets/textures/territory_logo/240.webp,240,240,Pridnestrovian Moldavian Republic U20 National Team,,0,1,1
1297,Trinidad and Tobago U20 National Team,user://assets/textures/territory_logo/241.webp,241,241,Republic of Trinidad and Tobago U20 National Team,,0,1,1
1298,Tristan da Cunha U20 National Team,user://assets/textures/territory_logo/242.webp,242,242,Tristan da Cunha U20 National Team,,0,1,1
1299,Tunisia U20 National Team,user://assets/textures/territory_logo/243.webp,243,243,Republic of Tunisia U20 National Team,,0,1,1
1300,Turkey U20 National Team,user://assets/textures/territory_logo/244.webp,244,244,Republic of Türkiye U20 National Team,,0,1,1
1301,Turkmenistan U20 National Team,user://assets/textures/territory_logo/245.webp,245,245,Turkmenistan U20 National Team,,0,1,1
1302,Turks and Caicos Islands U20 National Team,user://assets/textures/territory_logo/246.webp,246,246,Turks and Caicos Islands U20 National Team,,0,1,1
1303,Tuvalu U20 National Team,user://assets/textures/territory_logo/247.webp,247,247,Tuvalu U20 National Team,,0,1,1
1304,U.S. Virgin Islands U20 National Team,user://assets/textures/territory_logo/248.webp,248,248,Virgin Islands of the United States U20 National Team,,0,1,1
1305,Uganda U20 National Team,user://assets/textures/territory_logo/249.webp,249,249,Republic of Uganda U20 National Team,,0,1,1
1306,Ukraine U20 National Team,user://assets/textures/territory_logo/250.webp,250,250,Ukraine U20 National Team,,0,1,1
1307,United Arab Emirates U20 National Team,user://assets/textures/territory_logo/251.webp,251,251,United Arab Emirates U20 National Team,,0,1,1
1308,United States U20 National Team,user://assets/textures/territory_logo/252.webp,252,252,United States of America U20 National Team,,0,1,1
1309,Uruguay U20 National Team,user://assets/textures/territory_logo/253.webp,253,253,Oriental Republic of Uruguay U20 National Team,,0,1,1
1310,Uzbekistan U20 National Team,user://assets/textures/territory_logo/254.webp,254,254,Republic of Uzbekistan U20 National Team,,0,1,1
1311,Vanuatu U20 National Team,user://assets/textures/territory_logo/255.webp,255,255,Republic of Vanuatu U20 National Team,,0,1,1
1312,Vatican City U20 National Team,user://assets/textures/territory_logo/256.webp,256,256,Vatican City State U20 National Team,,0,1,1
1313,Venezuela U20 National Team,user://assets/textures/territory_logo/257.webp,257,257,Bolivarian Republic of Venezuela U20 National Team,,0,1,1
1314,Vietnam U20 National Team,user://assets/textures/territory_logo/258.webp,258,258,Socialist Republic of Vietnam U20 National Team,,0,1,1
1315,Wales U20 National Team,user://assets/textures/territory_logo/259.webp,259,259,Wales U20 National Team,,0,1,1
1316,Wallis and Futuna U20 National Team,user://assets/textures/territory_logo/260.webp,260,260,Territory of the Wallis and Futuna Islands U20 National Team,,0,1,1
1317,Yemen U20 National Team,user://assets/textures/territory_logo/261.webp,261,261,Republic of Yemen U20 National Team,,0,1,1
1318,Zambia U20 National Team,user://assets/textures/territory_logo/262.webp,262,262,Republic of Zambia U20 National Team,,0,1,1
1319,Zanzibar U20 National Team,user://assets/textures/territory_logo/263.webp,263,263,Zanzibar U20 National Team,,0,1,1
1320,Zimbabwe U20 National Team,user://assets/textures/territory_logo/264.webp,264,264,Republic of Zimbabwe U20 National Team,,0,1,1
1321,Abkhazia U20 Women's National Team,user://assets/textures/territory_logo/1.webp,265,1,Republic of Abkhazia U20 Women's National Team,,1,1,1
1322,Afghanistan U20 Women's National Team,user://assets/textures/territory_logo/2.webp,266,2,Islamic Emirate of Afghanistan U20 Women's National Team,,1,1,1
1323,Akrotiri and Dhekelia U20 Women's National Team,user://assets/textures/territory_logo/3.webp,267,3,Sovereign Base Areas of Akrotiri and Dhekelia U20 Women's National Team,,1,1,1
1324,Aland Islands U20 Women's National Team,user://assets/textures/territory_logo/4.webp,268,4,Åland U20 Women's National Team,,1,1,1
1325,Albania U20 Women's National Team,user://assets/textures/territory_logo/5.webp,269,5,Republic of Albania U20 Women's National Team,,1,1,1
1326,Algeria U20 Women's National Team,user://assets/textures/territory_logo/6.webp,270,6,People's Democratic Republic of Algeria U20 Women's National Team,,1,1,1
1327,American Samoa U20 Women's National Team,user://assets/textures/territory_logo/7.webp,271,7,American Samoa U20 Women's National Team,,1,1,1
1328,Andorra U20 Women's National Team,user://assets/textures/territory_logo/8.webp,272,8,Principality of Andorra U20 Women's National Team,,1,1,1
1329,Angola U20 Women's National Team,user://assets/textures/territory_logo/9.webp,273,9,Republic of Angola U20 Women's National Team,,1,1,1
1330,Anguilla U20 Women's National Team,user://assets/textures/territory_logo/10.webp,274,10,Anguilla U20 Women's National Team,,1,1,1
1331,Antigua and Barbuda U20 Women's National Team,user://assets/textures/territory_logo/11.webp,275,11,Antigua and Barbuda U20 Women's National Team,,1,1,1
1332,Argentina U20 Women's National Team,user://assets/textures/territory_logo/12.webp,276,12,Argentine Republic U20 Women's National Team,,1,1,1
1333,Armenia U20 Women's National Team,user://assets/textures/territory_logo/13.webp,277,13,Republic of Armenia U20 Women's National Team,,1,1,1
1334,Aruba U20 Women's National Team,user://assets/textures/territory_logo/14.webp,278,14,Country of Aruba U20 Women's National Team,,1,1,1
1335,Ascension Island U20 Women's National Team,user://assets/textures/territory_logo/15.webp,279,15,Ascension Island U20 Women's National Team,,1,1,1
1336,Australia U20 Women's National Team,user://assets/textures/territory_logo/16.webp,280,16,Commonwealth of Australia U20 Women's National Team,,1,1,1
1337,Austria U20 Women's National Team,user://assets/textures/territory_logo/17.webp,281,17,Republic of Austria U20 Women's National Team,,1,1,1
1338,Azerbaijan U20 Women's National Team,user://assets/textures/territory_logo/18.webp,282,18,Republic of Azerbaijan U20 Women's National Team,,1,1,1
1339,Bahamas U20 Women's National Team,user://assets/textures/territory_logo/19.webp,283,19,Commonwealth of the Bahamas U20 Women's National Team,,1,1,1
1340,Bahrain U20 Women's National Team,user://assets/textures/territory_logo/20.webp,284,20,Kingdom of Bahrain U20 Women's National Team,,1,1,1
1341,Bangladesh U20 Women's National Team,user://assets/textures/territory_logo/21.webp,285,21,People's Republic of Bangladesh U20 Women's National Team,,1,1,1
