id,name,logo_path,parent_id,territory_id,official_name,code,gender,is_active,team_type
1,Abkhazia National Team,user://assets/textures/territory_logo/1.webp,,1,Republic of Abkhazia National Team,,0,1,1
2,Afghanistan National Team,user://assets/textures/territory_logo/2.webp,,2,Islamic Emirate of Afghanistan National Team,,0,1,1
3,Akrotiri and Dhekelia National Team,user://assets/textures/territory_logo/3.webp,,3,Sovereign Base Areas of Akrotiri and Dhekelia National Team,,0,1,1
4,Aland Islands National Team,user://assets/textures/territory_logo/4.webp,,4,Åland National Team,,0,1,1
5,Albania National Team,user://assets/textures/territory_logo/5.webp,,5,Republic of Albania National Team,,0,1,1
6,Algeria National Team,user://assets/textures/territory_logo/6.webp,,6,People's Democratic Republic of Algeria National Team,,0,1,1
7,American Samoa National Team,user://assets/textures/territory_logo/7.webp,,7,American Samoa National Team,,0,1,1
8,Andorra National Team,user://assets/textures/territory_logo/8.webp,,8,Principality of Andorra National Team,,0,1,1
9,Angola National Team,user://assets/textures/territory_logo/9.webp,,9,Republic of Angola National Team,,0,1,1
10,Anguilla National Team,user://assets/textures/territory_logo/10.webp,,10,Anguilla National Team,,0,1,1
11,Antigua and Barbuda National Team,user://assets/textures/territory_logo/11.webp,,11,Antigua and Barbuda National Team,,0,1,1
12,Argentina National Team,user://assets/textures/territory_logo/12.webp,,12,Argentine Republic National Team,,0,1,1
13,Armenia National Team,user://assets/textures/territory_logo/13.webp,,13,Republic of Armenia National Team,,0,1,1
14,Aruba National Team,user://assets/textures/territory_logo/14.webp,,14,Country of Aruba National Team,,0,1,1
15,Ascension Island National Team,user://assets/textures/territory_logo/15.webp,,15,Ascension Island National Team,,0,1,1
16,Australia National Team,user://assets/textures/territory_logo/16.webp,,16,Commonwealth of Australia National Team,,0,1,1
17,Austria National Team,user://assets/textures/territory_logo/17.webp,,17,Republic of Austria National Team,,0,1,1
18,Azerbaijan National Team,user://assets/textures/territory_logo/18.webp,,18,Republic of Azerbaijan National Team,,0,1,1
19,Bahamas National Team,user://assets/textures/territory_logo/19.webp,,19,Commonwealth of the Bahamas National Team,,0,1,1
20,Bahrain National Team,user://assets/textures/territory_logo/20.webp,,20,Kingdom of Bahrain National Team,,0,1,1
21,Bangladesh National Team,user://assets/textures/territory_logo/21.webp,,21,People's Republic of Bangladesh National Team,,0,1,1
22,Barbados National Team,user://assets/textures/territory_logo/22.webp,,22,Barbados National Team,,0,1,1
23,Belarus National Team,user://assets/textures/territory_logo/23.webp,,23,Republic of Belarus National Team,,0,1,1
24,Belgium National Team,user://assets/textures/territory_logo/24.webp,,24,Kingdom of Belgium National Team,,0,1,1
25,Belize National Team,user://assets/textures/territory_logo/25.webp,,25,Belize National Team,,0,1,1
26,Benin National Team,user://assets/textures/territory_logo/26.webp,,26,Republic of Benin National Team,,0,1,1
27,Bermuda National Team,user://assets/textures/territory_logo/27.webp,,27,Bermuda National Team,,0,1,1
28,Bhutan National Team,user://assets/textures/territory_logo/28.webp,,28,Kingdom of Bhutan National Team,,0,1,1
29,Bolivia National Team,user://assets/textures/territory_logo/29.webp,,29,Plurinational State of Bolivia National Team,,0,1,1
30,Bonaire National Team,user://assets/textures/territory_logo/30.webp,,30,Bonaire National Team,,0,1,1
31,Bosnia and Herzegovina National Team,user://assets/textures/territory_logo/31.webp,,31,Bosnia and Herzegovina National Team,,0,1,1
32,Botswana National Team,user://assets/textures/territory_logo/32.webp,,32,Republic of Botswana National Team,,0,1,1
33,Brazil National Team,user://assets/textures/territory_logo/33.webp,,33,Federative Republic of Brazil National Team,,0,1,1
34,British Virgin Islands National Team,user://assets/textures/territory_logo/34.webp,,34,Virgin Islands National Team,,0,1,1
35,Brunei National Team,user://assets/textures/territory_logo/35.webp,,35,Brunei Darussalam National Team,,0,1,1
36,Bulgaria National Team,user://assets/textures/territory_logo/36.webp,,36,Republic of Bulgaria National Team,,0,1,1
37,Burkina Faso National Team,user://assets/textures/territory_logo/37.webp,,37,Burkina Faso National Team,,0,1,1
38,Burundi National Team,user://assets/textures/territory_logo/38.webp,,38,Republic of Burundi National Team,,0,1,1
39,Cambodia National Team,user://assets/textures/territory_logo/39.webp,,39,Kingdom of Cambodia National Team,,0,1,1
40,Cameroon National Team,user://assets/textures/territory_logo/40.webp,,40,Republic of Cameroon National Team,,0,1,1
41,Canada National Team,user://assets/textures/territory_logo/41.webp,,41,Canada National Team,,0,1,1
42,Cape Verde National Team,user://assets/textures/territory_logo/42.webp,,42,Republic of Cabo Verde National Team,,0,1,1
43,Cayman Islands National Team,user://assets/textures/territory_logo/43.webp,,43,Cayman Islands National Team,,0,1,1
44,Central African Republic National Team,user://assets/textures/territory_logo/44.webp,,44,Central African Republic National Team,,0,1,1
45,Chad National Team,user://assets/textures/territory_logo/45.webp,,45,Republic of Chad National Team,,0,1,1
46,Chile National Team,user://assets/textures/territory_logo/46.webp,,46,Republic of Chile National Team,,0,1,1
47,China National Team,user://assets/textures/territory_logo/47.webp,,47,People's Republic of China National Team,,0,1,1
48,Christmas Island National Team,user://assets/textures/territory_logo/48.webp,,48,Territory of Christmas Island National Team,,0,1,1
49,Cocos Islands National Team,user://assets/textures/territory_logo/49.webp,,49,Territory of Cocos (Keeling) Islands National Team,,0,1,1
50,Colombia National Team,user://assets/textures/territory_logo/50.webp,,50,Republic of Colombia National Team,,0,1,1
51,Comoros National Team,user://assets/textures/territory_logo/51.webp,,51,Union of the Comoros National Team,,0,1,1
52,Congo National Team,user://assets/textures/territory_logo/52.webp,,52,Republic of the Congo National Team,,0,1,1
53,Cook Islands National Team,user://assets/textures/territory_logo/53.webp,,53,Cook Islands National Team,,0,1,1
54,Costa Rica National Team,user://assets/textures/territory_logo/54.webp,,54,Republic of Costa Rica National Team,,0,1,1
55,Croatia National Team,user://assets/textures/territory_logo/55.webp,,55,Republic of Croatia National Team,,0,1,1
56,Cuba National Team,user://assets/textures/territory_logo/56.webp,,56,Republic of Cuba National Team,,0,1,1
57,Curaçao National Team,user://assets/textures/territory_logo/57.webp,,57,Country of Curaçao National Team,,0,1,1
58,Cyprus National Team,user://assets/textures/territory_logo/58.webp,,58,Republic of Cyprus National Team,,0,1,1
59,Czechia National Team,user://assets/textures/territory_logo/59.webp,,59,Czech Republic National Team,,0,1,1
60,Denmark National Team,user://assets/textures/territory_logo/60.webp,,60,Kingdom of Denmark National Team,,0,1,1
61,Djibouti National Team,user://assets/textures/territory_logo/61.webp,,61,Republic of Djibouti National Team,,0,1,1
62,Dominica National Team,user://assets/textures/territory_logo/62.webp,,62,Commonwealth of Dominica National Team,,0,1,1
63,Dominican Republic National Team,user://assets/textures/territory_logo/63.webp,,63,Dominican Republic National Team,,0,1,1
64,DR Congo National Team,user://assets/textures/territory_logo/64.webp,,64,Democratic Republic of the Congo National Team,,0,1,1
65,Timor-Leste National Team,user://assets/textures/territory_logo/65.webp,,65,Democratic Republic of Timor-Leste National Team,,0,1,1
66,Easter Island National Team,user://assets/textures/territory_logo/66.webp,,66,Easter Island National Team,,0,1,1
67,Ecuador National Team,user://assets/textures/territory_logo/67.webp,,67,Republic of Ecuador National Team,,0,1,1
68,Egypt National Team,user://assets/textures/territory_logo/68.webp,,68,Arab Republic of Egypt National Team,,0,1,1
69,El Salvador National Team,user://assets/textures/territory_logo/69.webp,,69,Republic of El Salvador National Team,,0,1,1
70,England National Team,user://assets/textures/territory_logo/70.webp,,70,England National Team,,0,1,1
71,Equatorial Guinea National Team,user://assets/textures/territory_logo/71.webp,,71,Republic of Equatorial Guinea National Team,,0,1,1
72,Eritrea National Team,user://assets/textures/territory_logo/72.webp,,72,State of Eritrea National Team,,0,1,1
73,Estonia National Team,user://assets/textures/territory_logo/73.webp,,73,Republic of Estonia National Team,,0,1,1
74,Eswatini National Team,user://assets/textures/territory_logo/74.webp,,74,Kingdom of Eswatini National Team,,0,1,1
75,Ethiopia National Team,user://assets/textures/territory_logo/75.webp,,75,Federal Democratic Republic of Ethiopia National Team,,0,1,1
76,Falkland Islands National Team,user://assets/textures/territory_logo/76.webp,,76,Falkland Islands National Team,,0,1,1
77,Faroe Islands National Team,user://assets/textures/territory_logo/77.webp,,77,Faroe Islands National Team,,0,1,1
78,Federated States of Micronesia National Team,user://assets/textures/territory_logo/78.webp,,78,Federated States of Micronesia National Team,,0,1,1
79,Fiji National Team,user://assets/textures/territory_logo/79.webp,,79,Republic of Fiji National Team,,0,1,1
80,Finland National Team,user://assets/textures/territory_logo/80.webp,,80,Republic of Finland National Team,,0,1,1
81,France National Team,user://assets/textures/territory_logo/81.webp,,81,French Republic National Team,,0,1,1
82,French Guiana National Team,user://assets/textures/territory_logo/82.webp,,82,French Guiana National Team,,0,1,1
83,French Polynesia National Team,user://assets/textures/territory_logo/83.webp,,83,French Polynesia National Team,,0,1,1
84,Gabon National Team,user://assets/textures/territory_logo/84.webp,,84,Gabonese Republic National Team,,0,1,1
85,The Gambia National Team,user://assets/textures/territory_logo/85.webp,,85,Republic of the Gambia National Team,,0,1,1
86,Georgia National Team,user://assets/textures/territory_logo/86.webp,,86,Georgia National Team,,0,1,1
87,Germany National Team,user://assets/textures/territory_logo/87.webp,,87,Federal Republic of Germany National Team,,0,1,1
88,Ghana National Team,user://assets/textures/territory_logo/88.webp,,88,Republic of Ghana National Team,,0,1,1
89,Gibraltar National Team,user://assets/textures/territory_logo/89.webp,,89,Gibraltar National Team,,0,1,1
90,Gozo National Team,user://assets/textures/territory_logo/90.webp,,90,Gozo National Team,,0,1,1
91,Greece National Team,user://assets/textures/territory_logo/91.webp,,91,Hellenic Republic National Team,,0,1,1
92,Greenland National Team,user://assets/textures/territory_logo/92.webp,,92,Greenland National Team,,0,1,1
93,Grenada National Team,user://assets/textures/territory_logo/93.webp,,93,Grenada National Team,,0,1,1
94,Guadeloupe National Team,user://assets/textures/territory_logo/94.webp,,94,Guadeloupe National Team,,0,1,1
95,Guam National Team,user://assets/textures/territory_logo/95.webp,,95,Guam National Team,,0,1,1
96,Guatemala National Team,user://assets/textures/territory_logo/96.webp,,96,Republic of Guatemala National Team,,0,1,1
97,Guernsey National Team,user://assets/textures/territory_logo/97.webp,,97,Guernsey National Team,,0,1,1
98,Guinea National Team,user://assets/textures/territory_logo/98.webp,,98,Republic of Guinea National Team,,0,1,1
99,Guinea-Bissau National Team,user://assets/textures/territory_logo/99.webp,,99,Republic of Guinea-Bissau National Team,,0,1,1
100,Guyana National Team,user://assets/textures/territory_logo/100.webp,,100,Co-operative Republic of Guyana National Team,,0,1,1
101,Haiti National Team,user://assets/textures/territory_logo/101.webp,,101,Republic of Haiti National Team,,0,1,1
102,Hawaii National Team,user://assets/textures/territory_logo/102.webp,,102,Hawaii National Team,,0,1,1
103,Honduras National Team,user://assets/textures/territory_logo/103.webp,,103,Republic of Honduras National Team,,0,1,1
104,Hong Kong National Team,user://assets/textures/territory_logo/104.webp,,104,Hong Kong National Team,,0,1,1
105,Hungary National Team,user://assets/textures/territory_logo/105.webp,,105,Hungary National Team,,0,1,1
106,Iceland National Team,user://assets/textures/territory_logo/106.webp,,106,Iceland National Team,,0,1,1
107,India National Team,user://assets/textures/territory_logo/107.webp,,107,Republic of India National Team,,0,1,1
108,Indonesia National Team,user://assets/textures/territory_logo/108.webp,,108,Republic of Indonesia National Team,,0,1,1
109,Iran National Team,user://assets/textures/territory_logo/109.webp,,109,Islamic Republic of Iran National Team,,0,1,1
110,Iraq National Team,user://assets/textures/territory_logo/110.webp,,110,Republic of Iraq National Team,,0,1,1
111,Ireland National Team,user://assets/textures/territory_logo/111.webp,,111,Republic of Ireland National Team,,0,1,1
112,Isle of Man National Team,user://assets/textures/territory_logo/112.webp,,112,Isle of Man National Team,,0,1,1
113,Isle of Wight National Team,user://assets/textures/territory_logo/113.webp,,113,Isle of Wight National Team,,0,1,1
114,Isles of Scilly National Team,user://assets/textures/territory_logo/114.webp,,114,Isles of Scilly National Team,,0,1,1
115,Israel National Team,user://assets/textures/territory_logo/115.webp,,115,State of Israel National Team,,0,1,1
116,Italy National Team,user://assets/textures/territory_logo/116.webp,,116,Italian Republic National Team,,0,1,1
117,Ivory Coast National Team,user://assets/textures/territory_logo/117.webp,,117,Republic of Côte d'Ivoire National Team,,0,1,1
118,Jamaica National Team,user://assets/textures/territory_logo/118.webp,,118,Jamaica National Team,,0,1,1
119,Japan National Team,user://assets/textures/territory_logo/119.webp,,119,Japan National Team,,0,1,1
120,Jersey National Team,user://assets/textures/territory_logo/120.webp,,120,Bailiwick of Jersey National Team,,0,1,1
121,Jordan National Team,user://assets/textures/territory_logo/121.webp,,121,Hashemite Kingdom of Jordan National Team,,0,1,1
122,Kazakhstan National Team,user://assets/textures/territory_logo/122.webp,,122,Republic of Kazakhstan National Team,,0,1,1
123,Kenya National Team,user://assets/textures/territory_logo/123.webp,,123,Republic of Kenya National Team,,0,1,1
124,Kiribati National Team,user://assets/textures/territory_logo/124.webp,,124,Republic of Kiribati National Team,,0,1,1
125,Kosovo National Team,user://assets/textures/territory_logo/125.webp,,125,Republic of Kosovo National Team,,0,1,1
126,Kuwait National Team,user://assets/textures/territory_logo/126.webp,,126,State of Kuwait National Team,,0,1,1
127,Kyrgyzstan National Team,user://assets/textures/territory_logo/127.webp,,127,Kyrgyz Republic National Team,,0,1,1
128,Laos National Team,user://assets/textures/territory_logo/128.webp,,128,Lao People's Democratic Republic National Team,,0,1,1
129,Latvia National Team,user://assets/textures/territory_logo/129.webp,,129,Republic of Latvia National Team,,0,1,1
130,Lebanon National Team,user://assets/textures/territory_logo/130.webp,,130,Republic of Lebanon National Team,,0,1,1
131,Lesotho National Team,user://assets/textures/territory_logo/131.webp,,131,Kingdom of Lesotho National Team,,0,1,1
132,Liberia National Team,user://assets/textures/territory_logo/132.webp,,132,Republic of Liberia National Team,,0,1,1
133,Libya National Team,user://assets/textures/territory_logo/133.webp,,133,State of Libya National Team,,0,1,1
134,Liechtenstein National Team,user://assets/textures/territory_logo/134.webp,,134,Principality of Liechtenstein National Team,,0,1,1
135,Lithuania National Team,user://assets/textures/territory_logo/135.webp,,135,Republic of Lithuania National Team,,0,1,1
136,Luxembourg National Team,user://assets/textures/territory_logo/136.webp,,136,Grand Duchy of Luxembourg National Team,,0,1,1
137,Macau National Team,user://assets/textures/territory_logo/137.webp,,137,Macau National Team,,0,1,1
138,Madagascar National Team,user://assets/textures/territory_logo/138.webp,,138,Republic of Madagascar National Team,,0,1,1
139,Madeira National Team,user://assets/textures/territory_logo/139.webp,,139,Autonomous Region of Madeira National Team,,0,1,1
140,Malawi National Team,user://assets/textures/territory_logo/140.webp,,140,Republic of Malawi National Team,,0,1,1
141,Malaysia National Team,user://assets/textures/territory_logo/141.webp,,141,Malaysia National Team,,0,1,1
142,Maldives National Team,user://assets/textures/territory_logo/142.webp,,142,Republic of Maldives National Team,,0,1,1
143,Mali National Team,user://assets/textures/territory_logo/143.webp,,143,Republic of Mali National Team,,0,1,1
144,Malta National Team,user://assets/textures/territory_logo/144.webp,,144,Republic of Malta National Team,,0,1,1
145,Marshall Islands National Team,user://assets/textures/territory_logo/145.webp,,145,Republic of the Marshall Islands National Team,,0,1,1
146,Martinique National Team,user://assets/textures/territory_logo/146.webp,,146,Martinique National Team,,0,1,1
147,Mauritania National Team,user://assets/textures/territory_logo/147.webp,,147,Islamic Republic of Mauritania National Team,,0,1,1
148,Mauritius National Team,user://assets/textures/territory_logo/148.webp,,148,Republic of Mauritius National Team,,0,1,1
149,Mayotte National Team,user://assets/textures/territory_logo/149.webp,,149,Department of Mayotte National Team,,0,1,1
150,Mexico National Team,user://assets/textures/territory_logo/150.webp,,150,United Mexican States National Team,,0,1,1
151,Moldova National Team,user://assets/textures/territory_logo/151.webp,,151,Republic of Moldova National Team,,0,1,1
152,Monaco National Team,user://assets/textures/territory_logo/152.webp,,152,Principality of Monaco National Team,,0,1,1
153,Mongolia National Team,user://assets/textures/territory_logo/153.webp,,153,Mongolia National Team,,0,1,1
154,Montenegro National Team,user://assets/textures/territory_logo/154.webp,,154,Montenegro National Team,,0,1,1
155,Montserrat National Team,user://assets/textures/territory_logo/155.webp,,155,Montserrat National Team,,0,1,1
156,Morocco National Team,user://assets/textures/territory_logo/156.webp,,156,Kingdom of Morocco National Team,,0,1,1
157,Mozambique National Team,user://assets/textures/territory_logo/157.webp,,157,Republic of Mozambique National Team,,0,1,1
158,Myanmar National Team,user://assets/textures/territory_logo/158.webp,,158,Republic of the Union of Myanmar National Team,,0,1,1
159,Namibia National Team,user://assets/textures/territory_logo/159.webp,,159,Republic of Namibia National Team,,0,1,1
160,Nauru National Team,user://assets/textures/territory_logo/160.webp,,160,Republic of Nauru National Team,,0,1,1
161,Nepal National Team,user://assets/textures/territory_logo/161.webp,,161,Federal Democratic Republic of Nepal National Team,,0,1,1
162,Netherlands National Team,user://assets/textures/territory_logo/162.webp,,162,Kingdom of the Netherlands National Team,,0,1,1
163,New Caledonia National Team,user://assets/textures/territory_logo/163.webp,,163,New Caledonia National Team,,0,1,1
164,New Zealand National Team,user://assets/textures/territory_logo/164.webp,,164,New Zealand National Team,,0,1,1
165,Nicaragua National Team,user://assets/textures/territory_logo/165.webp,,165,Republic of Nicaragua National Team,,0,1,1
166,Niger National Team,user://assets/textures/territory_logo/166.webp,,166,Republic of the Niger National Team,,0,1,1
167,Nigeria National Team,user://assets/textures/territory_logo/167.webp,,167,Federal Republic of Nigeria National Team,,0,1,1
168,Niue National Team,user://assets/textures/territory_logo/168.webp,,168,Niue National Team,,0,1,1
169,Norfolk Island National Team,user://assets/textures/territory_logo/169.webp,,169,Norfolk Island National Team,,0,1,1
170,North Korea National Team,user://assets/textures/territory_logo/170.webp,,170,Democratic People's Republic of Korea National Team,,0,1,1
171,North Macedonia National Team,user://assets/textures/territory_logo/171.webp,,171,Republic of North Macedonia National Team,,0,1,1
172,Northern Cyprus National Team,user://assets/textures/territory_logo/172.webp,,172,Turkish Republic of Northern Cyprus National Team,,0,1,1
173,Northern Ireland National Team,user://assets/textures/territory_logo/173.webp,,173,Northern Ireland National Team,,0,1,1
174,Northern Mariana Islands National Team,user://assets/textures/territory_logo/174.webp,,174,Commonwealth of the Northern Mariana Islands National Team,,0,1,1
175,Norway National Team,user://assets/textures/territory_logo/175.webp,,175,Kingdom of Norway National Team,,0,1,1
176,Oman National Team,user://assets/textures/territory_logo/176.webp,,176,Sultanate of Oman National Team,,0,1,1
177,Orkney National Team,user://assets/textures/territory_logo/177.webp,,177,Orkney National Team,,0,1,1
178,Pakistan National Team,user://assets/textures/territory_logo/178.webp,,178,Islamic Republic of Pakistan National Team,,0,1,1
179,Palau National Team,user://assets/textures/territory_logo/179.webp,,179,Republic of Palau National Team,,0,1,1
180,Palestine National Team,user://assets/textures/territory_logo/180.webp,,180,State of Palestine National Team,,0,1,1
181,Panama National Team,user://assets/textures/territory_logo/181.webp,,181,Republic of Panama National Team,,0,1,1
182,Papua New Guinea National Team,user://assets/textures/territory_logo/182.webp,,182,Independent State of Papua New Guinea National Team,,0,1,1
183,Paraguay National Team,user://assets/textures/territory_logo/183.webp,,183,Republic of Paraguay National Team,,0,1,1
184,Peru National Team,user://assets/textures/territory_logo/184.webp,,184,Republic of Peru National Team,,0,1,1
185,Philippines National Team,user://assets/textures/territory_logo/185.webp,,185,Republic of the Philippines National Team,,0,1,1
186,Pitcairn Islands National Team,user://assets/textures/territory_logo/186.webp,,186,"Pitcairn, Henderson, Ducie and Oeno Islands National Team",,0,1,1
187,Poland National Team,user://assets/textures/territory_logo/187.webp,,187,Republic of Poland National Team,,0,1,1
188,Portugal National Team,user://assets/textures/territory_logo/188.webp,,188,Portuguese Republic National Team,,0,1,1
189,Puerto Rico National Team,user://assets/textures/territory_logo/189.webp,,189,Commonwealth of Puerto Rico National Team,,0,1,1
190,Qatar National Team,user://assets/textures/territory_logo/190.webp,,190,State of Qatar National Team,,0,1,1
191,Réunion National Team,user://assets/textures/territory_logo/191.webp,,191,Réunion National Team,,0,1,1
192,Romania National Team,user://assets/textures/territory_logo/192.webp,,192,Romania National Team,,0,1,1
193,Russia National Team,user://assets/textures/territory_logo/193.webp,,193,Russian Federation National Team,,0,1,1
194,Rwanda National Team,user://assets/textures/territory_logo/194.webp,,194,Republic of Rwanda National Team,,0,1,1
195,Saba National Team,user://assets/textures/territory_logo/195.webp,,195,Saba National Team,,0,1,1
196,Sahrawi Republic National Team,user://assets/textures/territory_logo/196.webp,,196,Sahrawi Arab Democratic Republic National Team,,0,1,1
197,Saint Helena National Team,user://assets/textures/territory_logo/197.webp,,197,Saint Helena National Team,,0,1,1
198,Saint Kitts and Nevis National Team,user://assets/textures/territory_logo/198.webp,,198,Federation of Saint Kitts and Nevis National Team,,0,1,1
199,Saint Lucia National Team,user://assets/textures/territory_logo/199.webp,,199,Saint Lucia National Team,,0,1,1
200,Saint Martin National Team,user://assets/textures/territory_logo/200.webp,,200,Saint Martin National Team,,0,1,1
201,Saint Pierre and Miquelon National Team,user://assets/textures/territory_logo/201.webp,,201,Territorial Collectivity of Saint Pierre and Miquelon National Team,,0,1,1
202,Saint Vincent and the Grenadines National Team,user://assets/textures/territory_logo/202.webp,,202,Saint Vincent and the Grenadines National Team,,0,1,1
203,Saint-Barthélemy National Team,user://assets/textures/territory_logo/203.webp,,203,Collectivité territoriale de Saint-Barthélemy National Team,,0,1,1
204,Samoa National Team,user://assets/textures/territory_logo/204.webp,,204,Independent State of Samoa National Team,,0,1,1
205,San Marino National Team,user://assets/textures/territory_logo/205.webp,,205,Republic of San Marino National Team,,0,1,1
206,São Tomé and Príncipe National Team,user://assets/textures/territory_logo/206.webp,,206,Democratic Republic of São Tomé and Príncipe National Team,,0,1,1
207,Saudi Arabia National Team,user://assets/textures/territory_logo/207.webp,,207,Kingdom of Saudi Arabia National Team,,0,1,1
208,Scotland National Team,user://assets/textures/territory_logo/208.webp,,208,Scotland National Team,,0,1,1
209,Senegal National Team,user://assets/textures/territory_logo/209.webp,,209,Republic of Senegal National Team,,0,1,1
210,Serbia National Team,user://assets/textures/territory_logo/210.webp,,210,Republic of Serbia National Team,,0,1,1
211,Seychelles National Team,user://assets/textures/territory_logo/211.webp,,211,Republic of Seychelles National Team,,0,1,1
212,Sierra Leone National Team,user://assets/textures/territory_logo/212.webp,,212,Republic of Sierra Leone National Team,,0,1,1
213,Singapore National Team,user://assets/textures/territory_logo/213.webp,,213,Republic of Singapore National Team,,0,1,1
214,Sint Eustatius National Team,user://assets/textures/territory_logo/214.webp,,214,Sint Eustatius National Team,,0,1,1
215,Sint Maarten National Team,user://assets/textures/territory_logo/215.webp,,215,Sint Maarten National Team,,0,1,1
