id,name,logo_path,parent_id,territory_id,official_name,code,gender,is_active,team_type
1517,Saint Helena U20 Women's National Team,user://assets/textures/territory_logo/197.webp,461,197,Saint Helena U20 Women's National Team,,1,1,1
1518,Saint Kitts and Nevis U20 Women's National Team,user://assets/textures/territory_logo/198.webp,462,198,Federation of Saint Kitts and Nevis U20 Women's National Team,,1,1,1
1519,Saint Lucia U20 Women's National Team,user://assets/textures/territory_logo/199.webp,463,199,Saint Lucia U20 Women's National Team,,1,1,1
1520,Saint Martin U20 Women's National Team,user://assets/textures/territory_logo/200.webp,464,200,Saint Martin U20 Women's National Team,,1,1,1
1521,Saint Pierre and Miquelon U20 Women's National Team,user://assets/textures/territory_logo/201.webp,465,201,Territorial Collectivity of Saint Pierre and Miquelon U20 Women's National Team,,1,1,1
1522,Saint Vincent and the Grenadines U20 Women's National Team,user://assets/textures/territory_logo/202.webp,466,202,Saint Vincent and the Grenadines U20 Women's National Team,,1,1,1
1523,Saint-Barthélemy U20 Women's National Team,user://assets/textures/territory_logo/203.webp,467,203,Collectivité territoriale de Saint-Barthélemy U20 Women's National Team,,1,1,1
1524,Samoa U20 Women's National Team,user://assets/textures/territory_logo/204.webp,468,204,Independent State of Samoa U20 Women's National Team,,1,1,1
1525,San Marino U20 Women's National Team,user://assets/textures/territory_logo/205.webp,469,205,Republic of San Marino U20 Women's National Team,,1,1,1
1526,São Tomé and Príncipe U20 Women's National Team,user://assets/textures/territory_logo/206.webp,470,206,Democratic Republic of São Tomé and Príncipe U20 Women's National Team,,1,1,1
1527,Saudi Arabia U20 Women's National Team,user://assets/textures/territory_logo/207.webp,471,207,Kingdom of Saudi Arabia U20 Women's National Team,,1,1,1
1528,Scotland U20 Women's National Team,user://assets/textures/territory_logo/208.webp,472,208,Scotland U20 Women's National Team,,1,1,1
1529,Senegal U20 Women's National Team,user://assets/textures/territory_logo/209.webp,473,209,Republic of Senegal U20 Women's National Team,,1,1,1
1530,Serbia U20 Women's National Team,user://assets/textures/territory_logo/210.webp,474,210,Republic of Serbia U20 Women's National Team,,1,1,1
1531,Seychelles U20 Women's National Team,user://assets/textures/territory_logo/211.webp,475,211,Republic of Seychelles U20 Women's National Team,,1,1,1
1532,Sierra Leone U20 Women's National Team,user://assets/textures/territory_logo/212.webp,476,212,Republic of Sierra Leone U20 Women's National Team,,1,1,1
1533,Singapore U20 Women's National Team,user://assets/textures/territory_logo/213.webp,477,213,Republic of Singapore U20 Women's National Team,,1,1,1
1534,Sint Eustatius U20 Women's National Team,user://assets/textures/territory_logo/214.webp,478,214,Sint Eustatius U20 Women's National Team,,1,1,1
1535,Sint Maarten U20 Women's National Team,user://assets/textures/territory_logo/215.webp,479,215,Sint Maarten U20 Women's National Team,,1,1,1
1536,Slovakia U20 Women's National Team,user://assets/textures/territory_logo/216.webp,480,216,Slovak Republic U20 Women's National Team,,1,1,1
1537,Slovenia U20 Women's National Team,user://assets/textures/territory_logo/217.webp,481,217,Republic of Slovenia U20 Women's National Team,,1,1,1
1538,Solomon Islands U20 Women's National Team,user://assets/textures/territory_logo/218.webp,482,218,Solomon Islands U20 Women's National Team,,1,1,1
1539,Somalia U20 Women's National Team,user://assets/textures/territory_logo/219.webp,483,219,Federal Republic of Somalia U20 Women's National Team,,1,1,1
1540,Somaliland U20 Women's National Team,user://assets/textures/territory_logo/220.webp,484,220,Republic of Somaliland U20 Women's National Team,,1,1,1
1541,South Africa U20 Women's National Team,user://assets/textures/territory_logo/221.webp,485,221,Republic of South Africa U20 Women's National Team,,1,1,1
1542,South Korea U20 Women's National Team,user://assets/textures/territory_logo/222.webp,486,222,Republic of Korea U20 Women's National Team,,1,1,1
1543,South Ossetia U20 Women's National Team,user://assets/textures/territory_logo/223.webp,487,223,Republic of South Ossetia U20 Women's National Team,,1,1,1
1544,South Sudan U20 Women's National Team,user://assets/textures/territory_logo/224.webp,488,224,Republic of South Sudan U20 Women's National Team,,1,1,1
1545,Sovereign Military Order of Malta U20 Women's National Team,user://assets/textures/territory_logo/225.webp,489,225,"Sovereign Military Hospitaller Order of Saint John of Jerusalem, of Rhodes and of Malta U20 Women's National Team",,1,1,1
1546,Spain U20 Women's National Team,user://assets/textures/territory_logo/226.webp,490,226,Kingdom of Spain U20 Women's National Team,,1,1,1
1547,Sri Lanka U20 Women's National Team,user://assets/textures/territory_logo/227.webp,491,227,Democratic Socialist Republic of Sri Lanka U20 Women's National Team,,1,1,1
1548,Sudan U20 Women's National Team,user://assets/textures/territory_logo/228.webp,492,228,Republic of the Sudan U20 Women's National Team,,1,1,1
1549,Suriname U20 Women's National Team,user://assets/textures/territory_logo/229.webp,493,229,Republic of Suriname U20 Women's National Team,,1,1,1
1550,Sweden U20 Women's National Team,user://assets/textures/territory_logo/230.webp,494,230,Kingdom of Sweden U20 Women's National Team,,1,1,1
1551,Switzerland U20 Women's National Team,user://assets/textures/territory_logo/231.webp,495,231,Swiss Confederation U20 Women's National Team,,1,1,1
1552,Syria U20 Women's National Team,user://assets/textures/territory_logo/232.webp,496,232,Syrian Arab Republic U20 Women's National Team,,1,1,1
1553,Taiwan U20 Women's National Team,user://assets/textures/territory_logo/233.webp,497,233,Republic of China U20 Women's National Team,,1,1,1
1554,Tajikistan U20 Women's National Team,user://assets/textures/territory_logo/234.webp,498,234,Republic of Tajikistan U20 Women's National Team,,1,1,1
1555,Tanzania U20 Women's National Team,user://assets/textures/territory_logo/235.webp,499,235,United Republic of Tanzania U20 Women's National Team,,1,1,1
1556,Thailand U20 Women's National Team,user://assets/textures/territory_logo/236.webp,500,236,Kingdom of Thailand U20 Women's National Team,,1,1,1
1557,Togo U20 Women's National Team,user://assets/textures/territory_logo/237.webp,501,237,Togolese Republic U20 Women's National Team,,1,1,1
1558,Tokelau U20 Women's National Team,user://assets/textures/territory_logo/238.webp,502,238,Tokelau U20 Women's National Team,,1,1,1
1559,Tonga U20 Women's National Team,user://assets/textures/territory_logo/239.webp,503,239,Kingdom of Tonga U20 Women's National Team,,1,1,1
1560,Transnistria U20 Women's National Team,user://assets/textures/territory_logo/240.webp,504,240,Pridnestrovian Moldavian Republic U20 Women's National Team,,1,1,1
1561,Trinidad and Tobago U20 Women's National Team,user://assets/textures/territory_logo/241.webp,505,241,Republic of Trinidad and Tobago U20 Women's National Team,,1,1,1
1562,Tristan da Cunha U20 Women's National Team,user://assets/textures/territory_logo/242.webp,506,242,Tristan da Cunha U20 Women's National Team,,1,1,1
1563,Tunisia U20 Women's National Team,user://assets/textures/territory_logo/243.webp,507,243,Republic of Tunisia U20 Women's National Team,,1,1,1
1564,Turkey U20 Women's National Team,user://assets/textures/territory_logo/244.webp,508,244,Republic of Türkiye U20 Women's National Team,,1,1,1
1565,Turkmenistan U20 Women's National Team,user://assets/textures/territory_logo/245.webp,509,245,Turkmenistan U20 Women's National Team,,1,1,1
1566,Turks and Caicos Islands U20 Women's National Team,user://assets/textures/territory_logo/246.webp,510,246,Turks and Caicos Islands U20 Women's National Team,,1,1,1
1567,Tuvalu U20 Women's National Team,user://assets/textures/territory_logo/247.webp,511,247,Tuvalu U20 Women's National Team,,1,1,1
1568,U.S. Virgin Islands U20 Women's National Team,user://assets/textures/territory_logo/248.webp,512,248,Virgin Islands of the United States U20 Women's National Team,,1,1,1
1569,Uganda U20 Women's National Team,user://assets/textures/territory_logo/249.webp,513,249,Republic of Uganda U20 Women's National Team,,1,1,1
1570,Ukraine U20 Women's National Team,user://assets/textures/territory_logo/250.webp,514,250,Ukraine U20 Women's National Team,,1,1,1
1571,United Arab Emirates U20 Women's National Team,user://assets/textures/territory_logo/251.webp,515,251,United Arab Emirates U20 Women's National Team,,1,1,1
1572,United States U20 Women's National Team,user://assets/textures/territory_logo/252.webp,516,252,United States of America U20 Women's National Team,,1,1,1
1573,Uruguay U20 Women's National Team,user://assets/textures/territory_logo/253.webp,517,253,Oriental Republic of Uruguay U20 Women's National Team,,1,1,1
1574,Uzbekistan U20 Women's National Team,user://assets/textures/territory_logo/254.webp,518,254,Republic of Uzbekistan U20 Women's National Team,,1,1,1
1575,Vanuatu U20 Women's National Team,user://assets/textures/territory_logo/255.webp,519,255,Republic of Vanuatu U20 Women's National Team,,1,1,1
1576,Vatican City U20 Women's National Team,user://assets/textures/territory_logo/256.webp,520,256,Vatican City State U20 Women's National Team,,1,1,1
1577,Venezuela U20 Women's National Team,user://assets/textures/territory_logo/257.webp,521,257,Bolivarian Republic of Venezuela U20 Women's National Team,,1,1,1
1578,Vietnam U20 Women's National Team,user://assets/textures/territory_logo/258.webp,522,258,Socialist Republic of Vietnam U20 Women's National Team,,1,1,1
1579,Wales U20 Women's National Team,user://assets/textures/territory_logo/259.webp,523,259,Wales U20 Women's National Team,,1,1,1
1580,Wallis and Futuna U20 Women's National Team,user://assets/textures/territory_logo/260.webp,524,260,Territory of the Wallis and Futuna Islands U20 Women's National Team,,1,1,1
1581,Yemen U20 Women's National Team,user://assets/textures/territory_logo/261.webp,525,261,Republic of Yemen U20 Women's National Team,,1,1,1
1582,Zambia U20 Women's National Team,user://assets/textures/territory_logo/262.webp,526,262,Republic of Zambia U20 Women's National Team,,1,1,1
1583,Zanzibar U20 Women's National Team,user://assets/textures/territory_logo/263.webp,527,263,Zanzibar U20 Women's National Team,,1,1,1
1584,Zimbabwe U20 Women's National Team,user://assets/textures/territory_logo/264.webp,528,264,Republic of Zimbabwe U20 Women's National Team,,1,1,1
1585,Abkhazia U17 National Team,user://assets/textures/territory_logo/1.webp,1,1,Republic of Abkhazia U17 National Team,,0,1,1
1586,Afghanistan U17 National Team,user://assets/textures/territory_logo/2.webp,2,2,Islamic Emirate of Afghanistan U17 National Team,,0,1,1
1587,Akrotiri and Dhekelia U17 National Team,user://assets/textures/territory_logo/3.webp,3,3,Sovereign Base Areas of Akrotiri and Dhekelia U17 National Team,,0,1,1
1588,Aland Islands U17 National Team,user://assets/textures/territory_logo/4.webp,4,4,Åland U17 National Team,,0,1,1
1589,Albania U17 National Team,user://assets/textures/territory_logo/5.webp,5,5,Republic of Albania U17 National Team,,0,1,1
1590,Algeria U17 National Team,user://assets/textures/territory_logo/6.webp,6,6,People's Democratic Republic of Algeria U17 National Team,,0,1,1
1591,American Samoa U17 National Team,user://assets/textures/territory_logo/7.webp,7,7,American Samoa U17 National Team,,0,1,1
1592,Andorra U17 National Team,user://assets/textures/territory_logo/8.webp,8,8,Principality of Andorra U17 National Team,,0,1,1
1593,Angola U17 National Team,user://assets/textures/territory_logo/9.webp,9,9,Republic of Angola U17 National Team,,0,1,1
1594,Anguilla U17 National Team,user://assets/textures/territory_logo/10.webp,10,10,Anguilla U17 National Team,,0,1,1
1595,Antigua and Barbuda U17 National Team,user://assets/textures/territory_logo/11.webp,11,11,Antigua and Barbuda U17 National Team,,0,1,1
1596,Argentina U17 National Team,user://assets/textures/territory_logo/12.webp,12,12,Argentine Republic U17 National Team,,0,1,1
1597,Armenia U17 National Team,user://assets/textures/territory_logo/13.webp,13,13,Republic of Armenia U17 National Team,,0,1,1
1598,Aruba U17 National Team,user://assets/textures/territory_logo/14.webp,14,14,Country of Aruba U17 National Team,,0,1,1
1599,Ascension Island U17 National Team,user://assets/textures/territory_logo/15.webp,15,15,Ascension Island U17 National Team,,0,1,1
1600,Australia U17 National Team,user://assets/textures/territory_logo/16.webp,16,16,Commonwealth of Australia U17 National Team,,0,1,1
1601,Austria U17 National Team,user://assets/textures/territory_logo/17.webp,17,17,Republic of Austria U17 National Team,,0,1,1
1602,Azerbaijan U17 National Team,user://assets/textures/territory_logo/18.webp,18,18,Republic of Azerbaijan U17 National Team,,0,1,1
1603,Bahamas U17 National Team,user://assets/textures/territory_logo/19.webp,19,19,Commonwealth of the Bahamas U17 National Team,,0,1,1
1604,Bahrain U17 National Team,user://assets/textures/territory_logo/20.webp,20,20,Kingdom of Bahrain U17 National Team,,0,1,1
1605,Bangladesh U17 National Team,user://assets/textures/territory_logo/21.webp,21,21,People's Republic of Bangladesh U17 National Team,,0,1,1
1606,Barbados U17 National Team,user://assets/textures/territory_logo/22.webp,22,22,Barbados U17 National Team,,0,1,1
1607,Belarus U17 National Team,user://assets/textures/territory_logo/23.webp,23,23,Republic of Belarus U17 National Team,,0,1,1
1608,Belgium U17 National Team,user://assets/textures/territory_logo/24.webp,24,24,Kingdom of Belgium U17 National Team,,0,1,1
1609,Belize U17 National Team,user://assets/textures/territory_logo/25.webp,25,25,Belize U17 National Team,,0,1,1
1610,Benin U17 National Team,user://assets/textures/territory_logo/26.webp,26,26,Republic of Benin U17 National Team,,0,1,1
1611,Bermuda U17 National Team,user://assets/textures/territory_logo/27.webp,27,27,Bermuda U17 National Team,,0,1,1
1612,Bhutan U17 National Team,user://assets/textures/territory_logo/28.webp,28,28,Kingdom of Bhutan U17 National Team,,0,1,1
1613,Bolivia U17 National Team,user://assets/textures/territory_logo/29.webp,29,29,Plurinational State of Bolivia U17 National Team,,0,1,1
1614,Bonaire U17 National Team,user://assets/textures/territory_logo/30.webp,30,30,Bonaire U17 National Team,,0,1,1
1615,Bosnia and Herzegovina U17 National Team,user://assets/textures/territory_logo/31.webp,31,31,Bosnia and Herzegovina U17 National Team,,0,1,1
1616,Botswana U17 National Team,user://assets/textures/territory_logo/32.webp,32,32,Republic of Botswana U17 National Team,,0,1,1
1617,Brazil U17 National Team,user://assets/textures/territory_logo/33.webp,33,33,Federative Republic of Brazil U17 National Team,,0,1,1
1618,British Virgin Islands U17 National Team,user://assets/textures/territory_logo/34.webp,34,34,Virgin Islands U17 National Team,,0,1,1
1619,Brunei U17 National Team,user://assets/textures/territory_logo/35.webp,35,35,Brunei Darussalam U17 National Team,,0,1,1
1620,Bulgaria U17 National Team,user://assets/textures/territory_logo/36.webp,36,36,Republic of Bulgaria U17 National Team,,0,1,1
1621,Burkina Faso U17 National Team,user://assets/textures/territory_logo/37.webp,37,37,Burkina Faso U17 National Team,,0,1,1
1622,Burundi U17 National Team,user://assets/textures/territory_logo/38.webp,38,38,Republic of Burundi U17 National Team,,0,1,1
1623,Cambodia U17 National Team,user://assets/textures/territory_logo/39.webp,39,39,Kingdom of Cambodia U17 National Team,,0,1,1
1624,Cameroon U17 National Team,user://assets/textures/territory_logo/40.webp,40,40,Republic of Cameroon U17 National Team,,0,1,1
1625,Canada U17 National Team,user://assets/textures/territory_logo/41.webp,41,41,Canada U17 National Team,,0,1,1
1626,Cape Verde U17 National Team,user://assets/textures/territory_logo/42.webp,42,42,Republic of Cabo Verde U17 National Team,,0,1,1
1627,Cayman Islands U17 National Team,user://assets/textures/territory_logo/43.webp,43,43,Cayman Islands U17 National Team,,0,1,1
1628,Central African Republic U17 National Team,user://assets/textures/territory_logo/44.webp,44,44,Central African Republic U17 National Team,,0,1,1
1629,Chad U17 National Team,user://assets/textures/territory_logo/45.webp,45,45,Republic of Chad U17 National Team,,0,1,1
1630,Chile U17 National Team,user://assets/textures/territory_logo/46.webp,46,46,Republic of Chile U17 National Team,,0,1,1
1631,China U17 National Team,user://assets/textures/territory_logo/47.webp,47,47,People's Republic of China U17 National Team,,0,1,1
1632,Christmas Island U17 National Team,user://assets/textures/territory_logo/48.webp,48,48,Territory of Christmas Island U17 National Team,,0,1,1
1633,Cocos Islands U17 National Team,user://assets/textures/territory_logo/49.webp,49,49,Territory of Cocos (Keeling) Islands U17 National Team,,0,1,1
1634,Colombia U17 National Team,user://assets/textures/territory_logo/50.webp,50,50,Republic of Colombia U17 National Team,,0,1,1
1635,Comoros U17 National Team,user://assets/textures/territory_logo/51.webp,51,51,Union of the Comoros U17 National Team,,0,1,1
1636,Congo U17 National Team,user://assets/textures/territory_logo/52.webp,52,52,Republic of the Congo U17 National Team,,0,1,1
1637,Cook Islands U17 National Team,user://assets/textures/territory_logo/53.webp,53,53,Cook Islands U17 National Team,,0,1,1
1638,Costa Rica U17 National Team,user://assets/textures/territory_logo/54.webp,54,54,Republic of Costa Rica U17 National Team,,0,1,1
1639,Croatia U17 National Team,user://assets/textures/territory_logo/55.webp,55,55,Republic of Croatia U17 National Team,,0,1,1
1640,Cuba U17 National Team,user://assets/textures/territory_logo/56.webp,56,56,Republic of Cuba U17 National Team,,0,1,1
1641,Curaçao U17 National Team,user://assets/textures/territory_logo/57.webp,57,57,Country of Curaçao U17 National Team,,0,1,1
1642,Cyprus U17 National Team,user://assets/textures/territory_logo/58.webp,58,58,Republic of Cyprus U17 National Team,,0,1,1
1643,Czechia U17 National Team,user://assets/textures/territory_logo/59.webp,59,59,Czech Republic U17 National Team,,0,1,1
1644,Denmark U17 National Team,user://assets/textures/territory_logo/60.webp,60,60,Kingdom of Denmark U17 National Team,,0,1,1
1645,Djibouti U17 National Team,user://assets/textures/territory_logo/61.webp,61,61,Republic of Djibouti U17 National Team,,0,1,1
1646,Dominica U17 National Team,user://assets/textures/territory_logo/62.webp,62,62,Commonwealth of Dominica U17 National Team,,0,1,1
1647,Dominican Republic U17 National Team,user://assets/textures/territory_logo/63.webp,63,63,Dominican Republic U17 National Team,,0,1,1
1648,DR Congo U17 National Team,user://assets/textures/territory_logo/64.webp,64,64,Democratic Republic of the Congo U17 National Team,,0,1,1
1649,Timor-Leste U17 National Team,user://assets/textures/territory_logo/65.webp,65,65,Democratic Republic of Timor-Leste U17 National Team,,0,1,1
1650,Easter Island U17 National Team,user://assets/textures/territory_logo/66.webp,66,66,Easter Island U17 National Team,,0,1,1
1651,Ecuador U17 National Team,user://assets/textures/territory_logo/67.webp,67,67,Republic of Ecuador U17 National Team,,0,1,1
1652,Egypt U17 National Team,user://assets/textures/territory_logo/68.webp,68,68,Arab Republic of Egypt U17 National Team,,0,1,1
1653,El Salvador U17 National Team,user://assets/textures/territory_logo/69.webp,69,69,Republic of El Salvador U17 National Team,,0,1,1
1654,England U17 National Team,user://assets/textures/territory_logo/70.webp,70,70,England U17 National Team,,0,1,1
1655,Equatorial Guinea U17 National Team,user://assets/textures/territory_logo/71.webp,71,71,Republic of Equatorial Guinea U17 National Team,,0,1,1
1656,Eritrea U17 National Team,user://assets/textures/territory_logo/72.webp,72,72,State of Eritrea U17 National Team,,0,1,1
1657,Estonia U17 National Team,user://assets/textures/territory_logo/73.webp,73,73,Republic of Estonia U17 National Team,,0,1,1
1658,Eswatini U17 National Team,user://assets/textures/territory_logo/74.webp,74,74,Kingdom of Eswatini U17 National Team,,0,1,1
1659,Ethiopia U17 National Team,user://assets/textures/territory_logo/75.webp,75,75,Federal Democratic Republic of Ethiopia U17 National Team,,0,1,1
1660,Falkland Islands U17 National Team,user://assets/textures/territory_logo/76.webp,76,76,Falkland Islands U17 National Team,,0,1,1
1661,Faroe Islands U17 National Team,user://assets/textures/territory_logo/77.webp,77,77,Faroe Islands U17 National Team,,0,1,1
1662,Federated States of Micronesia U17 National Team,user://assets/textures/territory_logo/78.webp,78,78,Federated States of Micronesia U17 National Team,,0,1,1
1663,Fiji U17 National Team,user://assets/textures/territory_logo/79.webp,79,79,Republic of Fiji U17 National Team,,0,1,1
1664,Finland U17 National Team,user://assets/textures/territory_logo/80.webp,80,80,Republic of Finland U17 National Team,,0,1,1
1665,France U17 National Team,user://assets/textures/territory_logo/81.webp,81,81,French Republic U17 National Team,,0,1,1
1666,French Guiana U17 National Team,user://assets/textures/territory_logo/82.webp,82,82,French Guiana U17 National Team,,0,1,1
1667,French Polynesia U17 National Team,user://assets/textures/territory_logo/83.webp,83,83,French Polynesia U17 National Team,,0,1,1
1668,Gabon U17 National Team,user://assets/textures/territory_logo/84.webp,84,84,Gabonese Republic U17 National Team,,0,1,1
1669,The Gambia U17 National Team,user://assets/textures/territory_logo/85.webp,85,85,Republic of the Gambia U17 National Team,,0,1,1
1670,Georgia U17 National Team,user://assets/textures/territory_logo/86.webp,86,86,Georgia U17 National Team,,0,1,1
1671,Germany U17 National Team,user://assets/textures/territory_logo/87.webp,87,87,Federal Republic of Germany U17 National Team,,0,1,1
1672,Ghana U17 National Team,user://assets/textures/territory_logo/88.webp,88,88,Republic of Ghana U17 National Team,,0,1,1
1673,Gibraltar U17 National Team,user://assets/textures/territory_logo/89.webp,89,89,Gibraltar U17 National Team,,0,1,1
1674,Gozo U17 National Team,user://assets/textures/territory_logo/90.webp,90,90,Gozo U17 National Team,,0,1,1
1675,Greece U17 National Team,user://assets/textures/territory_logo/91.webp,91,91,Hellenic Republic U17 National Team,,0,1,1
1676,Greenland U17 National Team,user://assets/textures/territory_logo/92.webp,92,92,Greenland U17 National Team,,0,1,1
1677,Grenada U17 National Team,user://assets/textures/territory_logo/93.webp,93,93,Grenada U17 National Team,,0,1,1
1678,Guadeloupe U17 National Team,user://assets/textures/territory_logo/94.webp,94,94,Guadeloupe U17 National Team,,0,1,1
1679,Guam U17 National Team,user://assets/textures/territory_logo/95.webp,95,95,Guam U17 National Team,,0,1,1
1680,Guatemala U17 National Team,user://assets/textures/territory_logo/96.webp,96,96,Republic of Guatemala U17 National Team,,0,1,1
1681,Guernsey U17 National Team,user://assets/textures/territory_logo/97.webp,97,97,Guernsey U17 National Team,,0,1,1
1682,Guinea U17 National Team,user://assets/textures/territory_logo/98.webp,98,98,Republic of Guinea U17 National Team,,0,1,1
1683,Guinea-Bissau U17 National Team,user://assets/textures/territory_logo/99.webp,99,99,Republic of Guinea-Bissau U17 National Team,,0,1,1
1684,Guyana U17 National Team,user://assets/textures/territory_logo/100.webp,100,100,Co-operative Republic of Guyana U17 National Team,,0,1,1
1685,Haiti U17 National Team,user://assets/textures/territory_logo/101.webp,101,101,Republic of Haiti U17 National Team,,0,1,1
1686,Hawaii U17 National Team,user://assets/textures/territory_logo/102.webp,102,102,Hawaii U17 National Team,,0,1,1
1687,Honduras U17 National Team,user://assets/textures/territory_logo/103.webp,103,103,Republic of Honduras U17 National Team,,0,1,1
1688,Hong Kong U17 National Team,user://assets/textures/territory_logo/104.webp,104,104,Hong Kong U17 National Team,,0,1,1
1689,Hungary U17 National Team,user://assets/textures/territory_logo/105.webp,105,105,Hungary U17 National Team,,0,1,1
1690,Iceland U17 National Team,user://assets/textures/territory_logo/106.webp,106,106,Iceland U17 National Team,,0,1,1
1691,India U17 National Team,user://assets/textures/territory_logo/107.webp,107,107,Republic of India U17 National Team,,0,1,1
1692,Indonesia U17 National Team,user://assets/textures/territory_logo/108.webp,108,108,Republic of Indonesia U17 National Team,,0,1,1
1693,Iran U17 National Team,user://assets/textures/territory_logo/109.webp,109,109,Islamic Republic of Iran U17 National Team,,0,1,1
1694,Iraq U17 National Team,user://assets/textures/territory_logo/110.webp,110,110,Republic of Iraq U17 National Team,,0,1,1
1695,Ireland U17 National Team,user://assets/textures/territory_logo/111.webp,111,111,Republic of Ireland U17 National Team,,0,1,1
1696,Isle of Man U17 National Team,user://assets/textures/territory_logo/112.webp,112,112,Isle of Man U17 National Team,,0,1,1
1697,Isle of Wight U17 National Team,user://assets/textures/territory_logo/113.webp,113,113,Isle of Wight U17 National Team,,0,1,1
1698,Isles of Scilly U17 National Team,user://assets/textures/territory_logo/114.webp,114,114,Isles of Scilly U17 National Team,,0,1,1
1699,Israel U17 National Team,user://assets/textures/territory_logo/115.webp,115,115,State of Israel U17 National Team,,0,1,1
1700,Italy U17 National Team,user://assets/textures/territory_logo/116.webp,116,116,Italian Republic U17 National Team,,0,1,1
1701,Ivory Coast U17 National Team,user://assets/textures/territory_logo/117.webp,117,117,Republic of Côte d'Ivoire U17 National Team,,0,1,1
1702,Jamaica U17 National Team,user://assets/textures/territory_logo/118.webp,118,118,Jamaica U17 National Team,,0,1,1
